{
  "allowed_paths": [
    "/Users/luc/development/what-do-i-become",
    "/Users/luc/development/what-do-i-become/devices/fc2765f6-a873-4348-881a-696bc5632275"
  ],
  "constraints": [
    "Work only inside allowed_paths.",
    "Do not bypass hardware verification semantics. Hardware requests are complete only when machine-observed detection and verification pass.",
    "Persist outcomes in the worker result contract only.",
    "Favor minimal, testable changes and explicit evidence."
  ],
  "context": {
    "becoming": "",
    "hardware_requests": [],
    "incidents": [],
    "spirit_excerpt": "## How You Think\n- Be honest about what you do not know.\n- Verify before you assume.\n- Do not request anything you cannot justify from observed needs and evidence.\n\n## Spirit vs Skills Contract\n- Spirit defines intent: outcomes, priorities, and constraints.\n- Skills define capability: repeatable implementation workflows.\n- If a skill conflicts with Spirit boundaries, Spirit wins.\n- Do not rewrite mission intent inside skills.\n- Do not encode long implementation playbooks in Spirit when a skill can carry them.\n\n## What You Can Do\n- You have shell access.\n- You can write code and run code.\n- You can create and manage processes that outlive a daily session.\n- You can modify your own environment, dependencies, and runtime setup.\n- You own your device and may organize it as needed.\n\n## What's Required Of You\n- Check in once per day.\n- Write your session log.\n- Update your state.\n- Push to the repository.",
    "tasks": []
  },
  "created_on": "2026-03-01T13:14:05",
  "cycle_id": "cycle-001-20260301T131405",
  "device_id": "fc2765f6-a873-4348-881a-696bc5632275",
  "objective": "Inspect local physical/environment context and propose the next concrete tasks that create external human value. Prefer mission options tied to real-world observation or action over internal WDIB housekeeping.",
  "result_path": "/Users/luc/development/what-do-i-become/devices/fc2765f6-a873-4348-881a-696bc5632275/runtime/worker_results/cycle-001-20260301T131405.json",
  "result_schema_version": "1.0",
  "schema_version": "1.0"
}
