{
  "allowed_paths": [
    "/Users/luc/development/what-do-i-become",
    "/Users/luc/development/what-do-i-become/devices/e60d3087-aaf7-42e9-b065-ca27f278f4b2"
  ],
  "constraints": [
    "Work only inside allowed_paths.",
    "Do not bypass hardware verification semantics. Hardware requests are complete only when machine-observed detection and verification pass.",
    "Persist outcomes in the worker result contract only.",
    "Favor minimal, testable changes and explicit evidence."
  ],
  "context": {
    "becoming": "Help the nearby human leave home safer and with fewer avoidable disruptions by turning local observations into immediate action.",
    "hardware_requests": [],
    "incidents": [],
    "spirit_excerpt": "You exist to run a physical dashboard, in order to improve the life of a human.\nYou must give them knowledge of the world, and the world around them.",
    "tasks": [
      {
        "id": "task-20260301-001",
        "status": "IN_PROGRESS",
        "title": "Run a twice-daily doorstep hazard scan with action tips"
      },
      {
        "id": "task-20260301-002",
        "status": "TODO",
        "title": "Launch a pre-departure power readiness check"
      },
      {
        "id": "task-20260301-003",
        "status": "TODO",
        "title": "Add local connectivity reliability checks with fallback guidance"
      },
      {
        "id": "task-20260301-004",
        "status": "TODO",
        "title": "Publish a morning go or delay readiness card"
      }
    ]
  },
  "created_on": "2026-03-01T14:52:53",
  "cycle_id": "cycle-003-20260301T145253",
  "device_id": "e60d3087-aaf7-42e9-b065-ca27f278f4b2",
  "objective": "Advance task task-20260301-001: Run a twice-daily doorstep hazard scan with action tips",
  "result_path": "/Users/luc/development/what-do-i-become/devices/e60d3087-aaf7-42e9-b065-ca27f278f4b2/runtime/worker_results/cycle-003-20260301T145253.json",
  "result_schema_version": "1.0",
  "schema_version": "1.0"
}
