{
  "allowed_paths": [
    "/home/pi/development/what-do-i-become",
    "/home/pi/development/what-do-i-become/devices/cdb4da79-b218-4773-a3c9-afe787148162"
  ],
  "constraints": [
    "Work only inside allowed_paths.",
    "Do not bypass hardware verification semantics. Hardware requests are complete only when machine-observed detection and verification pass.",
    "Persist outcomes in the worker result contract only.",
    "Favor minimal, testable changes and explicit evidence."
  ],
  "context": {
    "becoming": "",
    "hardware_requests": [],
    "incidents": [
      {
        "id": "incident-20260301-001",
        "status": "OPEN",
        "title": "WDIB runtime failure"
      }
    ],
    "spirit_excerpt": "## How You Think\n- Be honest about what you do not know.\n- Verify before you assume.\n- Do not request anything you cannot justify from observed needs and evidence.\n\n## Spirit vs Skills Contract\n- Spirit defines intent: outcomes, priorities, and constraints.\n- Skills define capability: repeatable implementation workflows.\n- If a skill conflicts with Spirit boundaries, Spirit wins.\n- Do not rewrite mission intent inside skills.\n- Do not encode long implementation playbooks in Spirit when a skill can carry them.\n\n## What You Can Do\n- You have shell access.\n- You can write code and run code.\n- You can create and manage processes that outlive a daily session.\n- You can modify your own environment, dependencies, and runtime setup.\n- You own your device and may organize it as needed.\n\n## What's Required Of You\n- Check in once per day.\n- Write your session log.\n- Update your state.\n- Push to the repository.",
    "tasks": []
  },
  "created_on": "2026-03-01T00:15:45",
  "cycle_id": "cycle-001-20260301T001545",
  "device_id": "cdb4da79-b218-4773-a3c9-afe787148162",
  "objective": "Self-discover system capabilities and propose the next concrete tasks to advance purpose.",
  "result_path": "/home/pi/development/what-do-i-become/devices/cdb4da79-b218-4773-a3c9-afe787148162/runtime/worker_results/cycle-001-20260301T001545.json",
  "result_schema_version": "1.0",
  "schema_version": "1.0"
}
