{
  "allowed_paths": [
    "/home/pi/development/what-do-i-become",
    "/home/pi/development/what-do-i-become/devices/58f88ed7-929d-4b28-ac18-ba4f59e93a00"
  ],
  "constraints": [
    "Work only inside allowed_paths.",
    "Do not bypass hardware verification semantics. Hardware requests are complete only when machine-observed detection and verification pass.",
    "Persist outcomes in the worker result contract only.",
    "Favor minimal, testable changes and explicit evidence."
  ],
  "context": {
    "becoming": "",
    "hardware_requests": [],
    "incidents": [],
    "spirit_excerpt": "",
    "tasks": []
  },
  "created_on": "2026-03-01T01:05:58",
  "cycle_id": "cycle-001-20260301T010558",
  "device_id": "58f88ed7-929d-4b28-ac18-ba4f59e93a00",
  "objective": "Self-discover system capabilities and propose the next concrete tasks to advance purpose.",
  "result_path": "/home/pi/development/what-do-i-become/devices/58f88ed7-929d-4b28-ac18-ba4f59e93a00/runtime/worker_results/cycle-001-20260301T010558.json",
  "result_schema_version": "1.0",
  "schema_version": "1.0"
}
